What is bias? Expain the biases in case control study.,3-B,LOW,SE
"Define epidemiology, Explain the  uses of epidemiology. (1+4)",3-B,LOW,SE
Define Epidemiology What are the Tools of Measurements in Epidemiology. (1+4),3-B,MEDIUM,SE
Describe the types of Time trends in disease occurrence and its importance,3-B,MEDIUM,SE
What is a cohort? Discuss the types of cohort studies with exampLEs. (1+4),3-B,MEDIUM,SE
Compare and contrast case control and cohort studies. (2.5+2.5),3-B,MEDIUM,SE
Discuss the basic steps in conducting a randomised control trial.,3-B,MEDIUM,SE
Discuss briefly the types of randomised control trials.,3-B,MEDIUM,SE
Enumerate the types of epidemiological studies.,3-B,MEDIUM,SA
Briefly describe about Cross-sectional study.,3-B,MEDIUM,SA
What is a Hypothesis? Give two exampLEs.,3-B,MEDIUM,SA
What are the uses of Descriptive Epidemiological Studies?,3-B,MEDIUM,SA
What is a confounding factor? Explain with an exampLE.,3-B,HIGH,SA
What is Bias? Explain with exampLEs.,3-B,MEDIUM,SA
What are Cohort studies? Mention the types.,3-B,LOW,SA
What are ControlLEd trials? Name the types of study designs of controlLEd trials.,3-B,MEDIUM,SA
Define epidemic. Describe the steps involved in the investigation of an epidemic.(2+8),3-C,LOW,LE
Explain the dynamics of disease transmission with suitabLE exampLEs.,3-C,MEDIUM,LE
What is cold chain  Describe the cold chain equipments. (1+4),3-C,LOW,SE
What is association? Discuss different types of associations in causal studies. (1+4),3-C,MEDIUM,SE
Define a carrier of disease Classify the carriers with exampLEs. ,3-C,LOW,SE
Discuss the measures to control the reservoir in the chain of disease transmission.,3-C,MEDIUM,SE
Describe the methods in the interruption of  transmission of disease ,3-C,LOW,SE
What is epidemic. Explain with suitabLE exampLE .,3-C,LOW,SE
What is an   epidemic curve ? What are the uses of the same. (1+4),3-C,MEDIUM,SE
Define cold chain? what is the  VVM and its importance. (1+4),3-C,MEDIUM,SE
What is the  œOperational    definition of a disease?,3-C,HIGH,SA
What is  œSecular    trend of a disease with two exampLEs ?,3-C,HIGH,SA
Define an Epidemic and Endemic with two exampLEs.,3-C,MEDIUM,SA
What is an Epidemic? What are the types of epidemic?,3-C,HIGH,SA
What is an Epidemic curve? Draw an illustrated diagram.,3-C,HIGH,SA
Briefly describe Point source epidemic with a diagram.,3-C,MEDIUM,SA
Briefly describe a Common source epidemic with a diagram.,3-C,MEDIUM,SA
Briefly describe   Spot-map with a diagram.,3-C,MEDIUM,SA
What is Relative Risk? Explain its importance.,3-C,MEDIUM,SA
What is Odds ratio ? Explain its importance .,3-C,MEDIUM,SA
What is   Spurious  association? Explain with an exampLE.,3-C,LOW,SA
What is   Temporal  association? Explain with an exampLE.,3-C,MEDIUM,SA
What do you mean by Infection and Infestation? Explain with one exampLE of each.,3-C,MEDIUM,SA
Define   Sporadic  and   Pandemic ? Explain with one exampLE of each,3-C,MEDIUM,SA
Differentiate between Source and Reservoir of infection with an exampLE for each,3-C,MEDIUM,SA
Differentiate between  an   Index  case and   Primary  case.,3-C,MEDIUM,SA
Define   Carrier  of disease ? Enumerate the types of carriers.,3-C,LOW,SA
What is meant by Vertical transmission of a disease? Give four exampLEs.,3-C,MEDIUM,SA
What are the types of Biological modes of disease transmission? Give one exampLE for each,3-C,HIGH,SA
Define Incubation period? Name the types of incubation period,3-C,LOW,SA
Describe Herd immunity with an exampLE.,3-C,MEDIUM,SA
What is the concept of   Reverse  cold-chain?,3-C,HIGH,SA
What is Vaccine Vial Monitor(VVM)?  Mention its importance.,3-C,MEDIUM,SA
What is cold-chain? Name 3 cold chain equipments. ,3-C,MEDIUM,SA
Define Isolation and Quarantine. Give one exampLE of each.,3-C,MEDIUM,SA
Define the reservoir of the disease? Describe the types of the same. (1+4),3-C,MEDIUM,SE
Define a carrier of disease? Describe the types of the same. (2+3),3-C,MEDIUM,SE
Classify the modes of disease transmission explain with exampLEs . ,3-C,MEDIUM,SE
What is the biological transmission of disease? Describe the methods with exampLEs. (2+3) ,3-C,HIGH,SE
Define  the Control and Elimination of disease with an exampLE of each.,3-C,MEDIUM,SA
Distinguish between disease Elimination and Eradication.,3-C,MEDIUM,SA
What is meant by Open vial policy?,3-C,HIGH,SA
Describe the steps of investigation of food poisoning.,3-C,MEDIUM,LE
Define screening . Mention the types  and  uses of screening? (1+2+2),4-A,MEDIUM,SE
What is screening and discuss the types of screening with exampLEs? (1+4),4-A,MEDIUM,SE
What are the criteria for the disease to be screened?,4-A,LOW,SE
Mention the differences between a screening and a diagnostic test. (2.5+2.5),4-A,MEDIUM,SE
Explain screening for a disease in the concept of iceberg phenomenon of disease.,4-A,HIGH,SE
What are the criteria for an investigation to be accepted as a screening test?,4-A,MEDIUM,SE
What is screening? Describe the types of screening? (1+4),4-A,LOW,SE
What is HIGH-risk screening? Explain with exampLEs. (2+3),4-A,MEDIUM,SE
"What is   opportunistic  screening, discuss its advantages? (2+3)",4-A,LOW,SE
Define Screening . Mention three uses of screening with a exampLE for each.,4-A,LOW,SA
Describe the concept of  œLEad Time    with an exampLE.,4-A,MEDIUM,SA
Define Screening. What are the aims of Screening for a disease?,4-A,LOW,SA
What is meant by Mass Screening? Give two exampLEs.,4-A,MEDIUM,SA
What is HIGH risk screening? Give three exampLEs.,4-A,MEDIUM,SA
Describe Multi-phasic screening with an exampLE,4-A,MEDIUM,SA
Describe Opportunistic screening?Give three exampLEs.,4-A,LOW,SA
Describe the criteria for a disease to be screened and for a test to be accepted as a screening test. (5+5),4-B,MEDIUM,LE
What is meant by Validity of a screening test?,4-B,MEDIUM,SA
Define Sensitivity and Specificity of a screening test.,4-B,MEDIUM,SA
